{
  "type": "object",
  "additionalProperties": false,
  "properties": {
    "contract_version": {
      "const": "2.2"
    },
    "document_id": {
      "type": "string",
      "minLength": 1
    },
    "document_revision": {
      "type": "integer",
      "minimum": 1
    },
    "topics": {
      "type": "array",
      "items": {
        "$ref": "#/$defs/Topic"
      },
      "minItems": 0
    },
    "screens": {
      "type": "array",
      "items": {
        "$ref": "#/$defs/Screen"
      },
      "minItems": 0
    },
    "requirements": {
      "type": "array",
      "items": {
        "$ref": "#/$defs/Requirement"
      },
      "minItems": 0
    },
    "warnings": {
      "type": "array",
      "items": {
        "$ref": "#/$defs/Warning"
      },
      "minItems": 0
    }
  },
  "required": [
    "contract_version",
    "document_id",
    "document_revision",
    "topics",
    "screens",
    "requirements",
    "warnings"
  ],
  "$schema": "https://json-schema.org/draft/2020-12/schema",
  "title": "SpecPilot 기획서 요구사항 추출 초안 2.2",
  "$defs": {
    "SourceRef": {
      "type": "object",
      "additionalProperties": false,
      "properties": {
        "block_id": {
          "type": "string",
          "minLength": 1
        },
        "quote": {
          "type": "string",
          "minLength": 1
        }
      },
      "required": [
        "block_id",
        "quote"
      ]
    },
    "Topic": {
      "type": "object",
      "additionalProperties": false,
      "properties": {
        "key": {
          "type": "string",
          "minLength": 1
        },
        "title": {
          "type": "string",
          "minLength": 1
        },
        "title_origin": {
          "enum": [
            "extracted",
            "inferred",
            "unclassified"
          ]
        },
        "source_refs": {
          "type": "array",
          "items": {
            "$ref": "#/$defs/SourceRef"
          },
          "minItems": 0
        },
        "review_reasons": {
          "type": "array",
          "items": {
            "type": "string",
            "minLength": 1
          },
          "minItems": 0
        },
        "subtopics": {
          "type": "array",
          "items": {
            "$ref": "#/$defs/Subtopic"
          },
          "minItems": 1
        }
      },
      "required": [
        "key",
        "title",
        "title_origin",
        "source_refs",
        "review_reasons",
        "subtopics"
      ]
    },
    "Subtopic": {
      "type": "object",
      "additionalProperties": false,
      "properties": {
        "key": {
          "type": "string",
          "minLength": 1
        },
        "title": {
          "type": "string",
          "minLength": 1
        },
        "title_origin": {
          "enum": [
            "extracted",
            "inferred",
            "unclassified"
          ]
        },
        "source_refs": {
          "type": "array",
          "items": {
            "$ref": "#/$defs/SourceRef"
          },
          "minItems": 0
        },
        "review_reasons": {
          "type": "array",
          "items": {
            "type": "string",
            "minLength": 1
          },
          "minItems": 0
        },
        "screen_keys": {
          "type": "array",
          "items": {
            "type": "string",
            "minLength": 1
          },
          "uniqueItems": true
        }
      },
      "required": [
        "key",
        "title",
        "title_origin",
        "source_refs",
        "review_reasons",
        "screen_keys"
      ]
    },
    "Screen": {
      "type": "object",
      "additionalProperties": false,
      "properties": {
        "screen_key": {
          "type": "string",
          "minLength": 1
        },
        "title": {
          "type": "string",
          "minLength": 1
        },
        "source_block_ids": {
          "type": "array",
          "items": {
            "type": "string",
            "minLength": 1
          },
          "uniqueItems": true,
          "minItems": 1
        },
        "source_title": {
          "type": [
            "string",
            "null"
          ]
        },
        "source_screen_id": {
          "type": [
            "string",
            "null"
          ]
        },
        "depth_path": {
          "type": "array",
          "items": {
            "type": "string",
            "minLength": 1
          }
        },
        "view_type": {
          "enum": [
            "page",
            "error_state",
            "dialog",
            "unknown"
          ]
        },
        "base_screen_key": {
          "type": [
            "string",
            "null"
          ]
        }
      },
      "required": [
        "screen_key",
        "title",
        "source_block_ids",
        "source_title",
        "source_screen_id",
        "depth_path",
        "view_type",
        "base_screen_key"
      ]
    },
    "Condition": {
      "type": "object",
      "additionalProperties": false,
      "properties": {
        "stable_key": {
          "type": "string",
          "minLength": 1
        },
        "text": {
          "type": "string",
          "minLength": 1
        },
        "category": {
          "description": "display는 화면 표시, validation은 입력 검사 및 그 안내, error_message는 로그인 실패·중복 이메일 등 업무 확인 결과 메시지입니다. 구현 위치와는 별개입니다.",
          "enum": [
            "display",
            "validation",
            "navigation",
            "business_logic",
            "data",
            "error_message"
          ]
        },
        "target": {
          "description": "원문에 구현 위치가 명시된 경우만 지정하고 없으면 unknown입니다. 근거 후보 필터로 사용하지 않습니다.",
          "enum": [
            "frontend",
            "backend",
            "both",
            "unknown"
          ]
        },
        "verifiable": {
          "description": "category와 독립적으로 지정합니다. display도 코드로 확인 가능한 조건이면 code입니다.",
          "enum": [
            "code",
            "not_statically_verifiable"
          ]
        },
        "source_refs": {
          "type": "array",
          "items": {
            "$ref": "#/$defs/SourceRef"
          },
          "minItems": 1
        },
        "ambiguity": {
          "type": "string"
        },
        "related_condition_keys": {
          "type": "array",
          "items": {
            "type": "string",
            "minLength": 1
          },
          "uniqueItems": true
        },
        "constraint": {
          "description": "선택 수치 메타데이터입니다. 생략 또는 null을 허용하며 값이 있으면 객체 계약을 검사합니다. 수치·단위·경계는 text와 원문 출처에 보존합니다.",
          "default": null,
          "anyOf": [
            {
              "$ref": "#/$defs/Constraint"
            },
            {
              "type": "null"
            }
          ]
        }
      },
      "required": [
        "stable_key",
        "text",
        "category",
        "target",
        "verifiable",
        "source_refs",
        "ambiguity",
        "related_condition_keys"
      ]
    },
    "Requirement": {
      "type": "object",
      "additionalProperties": false,
      "properties": {
        "stable_key": {
          "type": "string",
          "minLength": 1
        },
        "subtopic_key": {
          "type": "string",
          "minLength": 1
        },
        "screen_key": {
          "type": [
            "string",
            "null"
          ],
          "minLength": 1
        },
        "title": {
          "type": "string",
          "minLength": 1
        },
        "original_text": {
          "type": "string",
          "minLength": 1
        },
        "condition": {
          "type": "string"
        },
        "action": {
          "type": "string"
        },
        "expected": {
          "type": "string"
        },
        "req_type": {
          "enum": [
            "functional",
            "non_functional"
          ]
        },
        "origin": {
          "const": "extracted"
        },
        "source_refs": {
          "type": "array",
          "items": {
            "$ref": "#/$defs/SourceRef"
          },
          "minItems": 1
        },
        "conditions": {
          "type": "array",
          "items": {
            "$ref": "#/$defs/Condition"
          },
          "minItems": 1
        },
        "review_reasons": {
          "type": "array",
          "items": {
            "type": "string",
            "minLength": 1
          },
          "minItems": 0
        },
        "source_markers": {
          "type": "array",
          "items": {
            "$ref": "#/$defs/SourceMarker"
          }
        }
      },
      "required": [
        "stable_key",
        "subtopic_key",
        "screen_key",
        "title",
        "original_text",
        "condition",
        "action",
        "expected",
        "req_type",
        "origin",
        "source_refs",
        "conditions",
        "review_reasons",
        "source_markers"
      ]
    },
    "Warning": {
      "type": "object",
      "additionalProperties": false,
      "properties": {
        "code": {
          "type": "string",
          "minLength": 1
        },
        "message": {
          "type": "string",
          "minLength": 1
        },
        "block_ids": {
          "type": "array",
          "items": {
            "type": "string",
            "minLength": 1
          },
          "uniqueItems": true
        }
      },
      "required": [
        "code",
        "message",
        "block_ids"
      ]
    },
    "SourceMarker": {
      "type": "object",
      "additionalProperties": false,
      "properties": {
        "block_id": {
          "type": "string",
          "minLength": 1
        },
        "section": {
          "enum": [
            "description",
            "action",
            "annotation",
            "table",
            "paragraph"
          ]
        },
        "label": {
          "type": [
            "string",
            "null"
          ]
        }
      },
      "required": [
        "block_id",
        "section",
        "label"
      ]
    },
    "Constraint": {
      "type": "object",
      "additionalProperties": false,
      "properties": {
        "field": {
          "type": "string",
          "minLength": 1
        },
        "operator": {
          "enum": [
            "le",
            "lt",
            "ge",
            "gt",
            "eq"
          ]
        },
        "value": {
          "type": "number"
        },
        "unit": {
          "type": "string",
          "minLength": 1
        },
        "unit_definition": {
          "type": [
            "string",
            "null"
          ]
        }
      },
      "required": [
        "field",
        "operator",
        "value",
        "unit",
        "unit_definition"
      ]
    }
  }
}
