{
  "contract_version": "2.2",
  "document_id": "doc-hansung-v02",
  "document_revision": 1,
  "topics": [
    {
      "key": "NOTICE",
      "title": "공지사항",
      "title_origin": "extracted",
      "source_refs": [
        {
          "block_id": "p09-header",
          "quote": "공지사항 관리"
        }
      ],
      "review_reasons": [],
      "subtopics": [
        {
          "key": "NOTICE-CREATE",
          "title": "공지사항 작성",
          "title_origin": "extracted",
          "source_refs": [
            {
              "block_id": "p09-header",
              "quote": "공지사항 등록"
            }
          ],
          "review_reasons": [],
          "screen_keys": [
            "NOTICE-002",
            "NOTICE-003"
          ]
        }
      ]
    }
  ],
  "screens": [
    {
      "screen_key": "NOTICE-002",
      "title": "공지사항 작성",
      "source_title": "공지사항 등록",
      "source_screen_id": "NOTICE-002",
      "depth_path": [
        "공지사항 관리"
      ],
      "view_type": "page",
      "base_screen_key": null,
      "source_block_ids": [
        "p09-header",
        "p09-description-1",
        "p09-description-7"
      ]
    },
    {
      "screen_key": "NOTICE-003",
      "title": "등록 취소 확인",
      "source_title": "공지사항 등록(취소)",
      "source_screen_id": "NOTICE-003",
      "depth_path": [
        "공지사항 관리"
      ],
      "view_type": "dialog",
      "base_screen_key": "NOTICE-002",
      "source_block_ids": [
        "p10-header",
        "p10-action-A",
        "p10-action-B"
      ]
    }
  ],
  "requirements": [
    {
      "stable_key": "NOTICE-002-1",
      "subtopic_key": "NOTICE-CREATE",
      "screen_key": "NOTICE-002",
      "title": "공지사항 제목 입력 제한과 글자 수 표시",
      "original_text": "공지사항의제목을 작성하며, 제목은 50자까지 입력할 수있다. 50자가넘어가면입력을 할수없으며, 입력창의오른쪽 아래입\n력한글자수가표시된다.",
      "source_markers": [
        {
          "block_id": "p09-description-1",
          "section": "description",
          "label": "1"
        }
      ],
      "condition": "공지사항 제목을 입력하는 경우",
      "action": "제목 입력",
      "expected": "50자까지 입력할 수 있고 초과 입력을 막으며 입력한 글자 수를 표시한다.",
      "req_type": "functional",
      "origin": "extracted",
      "source_refs": [
        {
          "block_id": "p09-description-1",
          "quote": "공지사항의제목을 작성하며, 제목은 50자까지 입력할 수있다. 50자가넘어가면입력을 할수없으며, 입력창의오른쪽 아래입\n력한글자수가표시된다."
        }
      ],
      "conditions": [
        {
          "stable_key": "NOTICE-002-1-C1",
          "text": "제목은 50자까지 입력할 수 있다.",
          "category": "validation",
          "target": "unknown",
          "verifiable": "code",
          "source_refs": [
            {
              "block_id": "p09-description-1",
              "quote": "제목은 50자까지 입력할 수있다."
            }
          ],
          "constraint": {
            "field": "notice.title.length",
            "operator": "le",
            "value": 50,
            "unit": "character",
            "unit_definition": null
          },
          "ambiguity": "문자 수 계산 방식은 원문에 명시되지 않음",
          "related_condition_keys": []
        },
        {
          "stable_key": "NOTICE-002-1-C2",
          "text": "제목 50자 초과 입력을 막는다.",
          "category": "validation",
          "target": "unknown",
          "verifiable": "code",
          "source_refs": [
            {
              "block_id": "p09-description-1",
              "quote": "50자가넘어가면입력을 할수없으며"
            }
          ],
          "constraint": null,
          "ambiguity": "",
          "related_condition_keys": []
        },
        {
          "stable_key": "NOTICE-002-1-C3",
          "text": "제목 입력창 오른쪽 아래에 입력한 글자 수를 표시한다.",
          "category": "display",
          "target": "unknown",
          "verifiable": "code",
          "source_refs": [
            {
              "block_id": "p09-description-1",
              "quote": "공지사항의제목을 작성하며, 제목은 50자까지 입력할 수있다. 50자가넘어가면입력을 할수없으며, 입력창의오른쪽 아래입\n력한글자수가표시된다."
            }
          ],
          "ambiguity": "",
          "related_condition_keys": []
        }
      ],
      "review_reasons": [
        "문자 수 계산 방식은 원문에 명시되지 않음"
      ]
    },
    {
      "stable_key": "NOTICE-002-7",
      "subtopic_key": "NOTICE-CREATE",
      "screen_key": "NOTICE-002",
      "title": "첨부 파일 등록·크기 제한·삭제",
      "original_text": "공지사항에포함되는첨부파일이저장되며, 첨부파일은하나만 업로드 가능하다. 첨부파일을업로드하게되면입력창 안에첨부\n파일의 이름이 넣어지며넣은첨부파일은창안에 x버튼으로삭제할 수있다.\n(1) 첨부파일은50MB이하의 파일만 업로드 가능하며, 50MB초과일 시, 다음과 같이에러메시지가표시된다.\n* error-msg: 첨부파일의크기는 50MB이하만 가능합니다.",
      "source_markers": [
        {
          "block_id": "p09-description-7",
          "section": "description",
          "label": "7"
        }
      ],
      "condition": "공지사항 작성 화면에서 첨부 파일을 선택하는 경우",
      "action": "첨부 파일 선택 또는 x 버튼 클릭",
      "expected": "첨부는 1개이고 50MB 이하만 허용하며 파일명 표시·삭제와 초과 크기 오류 메시지를 제공한다.",
      "req_type": "functional",
      "origin": "extracted",
      "source_refs": [
        {
          "block_id": "p09-description-7",
          "quote": "공지사항에포함되는첨부파일이저장되며, 첨부파일은하나만 업로드 가능하다. 첨부파일을업로드하게되면입력창 안에첨부\n파일의 이름이 넣어지며넣은첨부파일은창안에 x버튼으로삭제할 수있다.\n(1) 첨부파일은50MB이하의 파일만 업로드 가능하며, 50MB초과일 시, 다음과 같이에러메시지가표시된다.\n* error-msg: 첨부파일의크기는 50MB이하만 가능합니다."
        }
      ],
      "conditions": [
        {
          "stable_key": "NOTICE-002-7-C1",
          "text": "첨부 파일은 하나만 업로드할 수 있다.",
          "category": "validation",
          "target": "unknown",
          "verifiable": "code",
          "source_refs": [
            {
              "block_id": "p09-description-7",
              "quote": "첨부파일은하나만 업로드 가능하다."
            }
          ],
          "constraint": {
            "field": "notice.attachments.count",
            "operator": "le",
            "value": 1,
            "unit": "file",
            "unit_definition": null
          },
          "ambiguity": "",
          "related_condition_keys": []
        },
        {
          "stable_key": "NOTICE-002-7-C2",
          "text": "첨부 파일 크기는 50MB 이하만 허용한다.",
          "category": "validation",
          "target": "unknown",
          "verifiable": "code",
          "source_refs": [
            {
              "block_id": "p09-description-7",
              "quote": "첨부파일은50MB이하의 파일만 업로드 가능하며"
            }
          ],
          "constraint": {
            "field": "notice.attachment.size",
            "operator": "le",
            "value": 50,
            "unit": "MB",
            "unit_definition": null
          },
          "ambiguity": "MB를 1,000,000바이트 또는 1,048,576바이트로 계산하는지 확인 필요",
          "related_condition_keys": []
        },
        {
          "stable_key": "NOTICE-002-7-C3",
          "text": "업로드한 파일명을 첨부 입력창 안에 표시한다.",
          "category": "display",
          "target": "unknown",
          "verifiable": "code",
          "source_refs": [
            {
              "block_id": "p09-description-7",
              "quote": "공지사항에포함되는첨부파일이저장되며, 첨부파일은하나만 업로드 가능하다. 첨부파일을업로드하게되면입력창 안에첨부\n파일의 이름이 넣어지며넣은첨부파일은창안에 x버튼으로삭제할 수있다.\n(1) 첨부파일은50MB이하의 파일만 업로드 가능하며, 50MB초과일 시, 다음과 같이에러메시지가표시된다.\n* error-msg: 첨부파일의크기는 50MB이하만 가능합니다."
            }
          ],
          "ambiguity": "",
          "related_condition_keys": []
        },
        {
          "stable_key": "NOTICE-002-7-C4",
          "text": "첨부 입력창 안의 x 버튼으로 첨부 파일을 삭제할 수 있다.",
          "category": "business_logic",
          "target": "unknown",
          "verifiable": "code",
          "source_refs": [
            {
              "block_id": "p09-description-7",
              "quote": "공지사항에포함되는첨부파일이저장되며, 첨부파일은하나만 업로드 가능하다. 첨부파일을업로드하게되면입력창 안에첨부\n파일의 이름이 넣어지며넣은첨부파일은창안에 x버튼으로삭제할 수있다.\n(1) 첨부파일은50MB이하의 파일만 업로드 가능하며, 50MB초과일 시, 다음과 같이에러메시지가표시된다.\n* error-msg: 첨부파일의크기는 50MB이하만 가능합니다."
            }
          ],
          "constraint": null,
          "ambiguity": "",
          "related_condition_keys": []
        },
        {
          "stable_key": "NOTICE-002-7-C5",
          "text": "50MB 초과 파일 선택 시 크기 제한 오류 메시지를 표시한다.",
          "category": "validation",
          "target": "unknown",
          "verifiable": "code",
          "source_refs": [
            {
              "block_id": "p09-description-7",
              "quote": "첨부파일의크기는 50MB이하만 가능합니다."
            }
          ],
          "constraint": null,
          "ambiguity": "",
          "related_condition_keys": []
        }
      ],
      "review_reasons": [
        "MB를 1,000,000바이트 또는 1,048,576바이트로 계산하는지 확인 필요"
      ]
    },
    {
      "stable_key": "NOTICE-003-A",
      "subtopic_key": "NOTICE-CREATE",
      "screen_key": "NOTICE-003",
      "title": "등록 취소 팝업에서 입력 계속",
      "original_text": "팝업이 없어지고입력한 신규등록화면으로돌아간다.",
      "source_markers": [
        {
          "block_id": "p10-action-A",
          "section": "action",
          "label": "A"
        }
      ],
      "condition": "등록 취소 팝업에서 아니오를 누르는 경우",
      "action": "아니오 클릭",
      "expected": "팝업을 닫고 입력 중이던 신규등록 화면으로 돌아간다.",
      "req_type": "functional",
      "origin": "extracted",
      "source_refs": [
        {
          "block_id": "p10-action-A",
          "quote": "팝업이 없어지고입력한 신규등록화면으로돌아간다."
        }
      ],
      "conditions": [
        {
          "stable_key": "NOTICE-003-A-C1",
          "text": "아니오를 클릭하면 팝업을 닫고 신규등록 화면으로 돌아간다.",
          "category": "navigation",
          "target": "unknown",
          "verifiable": "code",
          "source_refs": [
            {
              "block_id": "p10-action-A",
              "quote": "팝업이 없어지고입력한 신규등록화면으로돌아간다."
            }
          ],
          "constraint": null,
          "ambiguity": "",
          "related_condition_keys": []
        }
      ],
      "review_reasons": []
    },
    {
      "stable_key": "NOTICE-003-B",
      "subtopic_key": "NOTICE-CREATE",
      "screen_key": "NOTICE-003",
      "title": "등록 내용 취소 후 목록 이동",
      "original_text": "신규등록화면에서등록한 내용을 취소하고공지사항목록으로이동한다.",
      "source_markers": [
        {
          "block_id": "p10-action-B",
          "section": "action",
          "label": "B"
        }
      ],
      "condition": "등록 취소 팝업에서 네를 누르는 경우",
      "action": "네 클릭",